{
    "$schema": "http://json-schema.org/draft-07/schema#",
    "title": "Person",
    "properties": {
        "name": {
            "type": "string"
        },
        "lastname": {
            "type": "string"
        },
        "phone": {
            "type": "string"
        },
        "birthdate": {
            "type": "string"
        }

    },
    "required": ["name", "lastname", "phone", "birthdate"],
    "additionalProperties": false
}
