[
    {
        "name": "odissey",
        "lastname": "meltonyan",
        "phone": "123123",
        "birthdate": "01.01.1999"
    },
    {
        "name": "igor",
        "lastname": "vikhorkov",
        "phone": "777777",
        "birthdate": "07.07.1977"
    },
    {
        "name": "Yaroslav",
        "lastname": "Mindal",
        "phone": "099099",
        "birthdate": "12.12.2012"
    }
]
